{
  "schemaVersion": "1", "modelVersion": "2.0.0", "sim": "org", "seed": 42,
  "iterations": 500, "horizon": 60,
  "org": { "headcountStart": 20, "headcountGrowthPerStep": 0,
    "topology": "hierarchical", "hierarchyDepth": 2, "ownershipLayers": 2,
    "matrix": { "enabled": true, "tiebreaker": 1 },
    "modality": "asyncFirst", "structuralHealth": 6,
    "aiInjection": { "enabled": false, "atStep": 0 } }
}
